{
  "report_version": 1,
  "identity": {
    "project_path": "group/project",
    "issue_url": "https://gitlab.example/group/project/-/issues/124",
    "issue_title": "Synthetic rework-wait-resume scenario",
    "work_type": "feature",
    "product_area": "synthetic-area",
    "primary_dri": "pm-dri",
    "issue_state_model": "issue_status",
    "issue_state_value": "Verification",
    "state_observed_at": "2026-10-12T12:00:00Z",
    "tracking_item_refs": [
      "https://gitlab.example/group/project/-/issues/124"
    ]
  },
  "roles": [
    {
      "phase_or_decision": "validation",
      "role_name": "Product Manager",
      "person_or_group": "pm-dri",
      "authority_basis": "Synthetic scenario assignment only; not an Ordessa grant.",
      "approval_ref": null
    },
    {
      "phase_or_decision": "design",
      "role_name": "Product Designer",
      "person_or_group": "design-dri",
      "authority_basis": "Synthetic scenario assignment only; not an Ordessa grant.",
      "approval_ref": null
    },
    {
      "phase_or_decision": "build",
      "role_name": "Engineering DRI",
      "person_or_group": "eng-dri",
      "authority_basis": "Synthetic scenario assignment only; not an Ordessa grant.",
      "approval_ref": null
    },
    {
      "phase_or_decision": "review",
      "role_name": "Maintainer / reviewer",
      "person_or_group": "maintainer-dri",
      "authority_basis": "Synthetic scenario assignment only; not an Ordessa grant.",
      "approval_ref": null
    },
    {
      "phase_or_decision": "deployment",
      "role_name": "Release owner",
      "person_or_group": "release-dri",
      "authority_basis": "Synthetic scenario assignment only; not an Ordessa grant.",
      "approval_ref": null
    },
    {
      "phase_or_decision": "outcome",
      "role_name": "Product owner",
      "person_or_group": "pm-dri",
      "authority_basis": "Synthetic scenario assignment only; not an Ordessa grant.",
      "approval_ref": null
    }
  ],
  "validation_track": {
    "applicability": "applicable",
    "applicability_rationale": "Validation depth is chosen for this synthetic feature scenario.",
    "problem_validation": {
      "status": "completed",
      "entered_at": "2026-10-01T09:00:00Z",
      "exited_at": "2026-10-02T09:00:00Z",
      "owner": "pm-dri",
      "outcome_or_skip_rationale": "Problem and solution validation completed with the recorded user evidence.",
      "evidence_refs": [
        "https://gitlab.example/group/project/-/issues/123"
      ],
      "decision": {
        "result": "proceed",
        "rationale": "Problem and solution validation completed with the recorded user evidence.",
        "decided_by": "pm-dri",
        "decided_at": "2026-10-12T12:00:00Z",
        "approval_or_record_ref": null
      }
    },
    "design": {
      "status": "completed",
      "entered_at": "2026-10-01T09:00:00Z",
      "exited_at": "2026-10-02T09:00:00Z",
      "owner": "design-dri",
      "outcome_or_skip_rationale": "Design review recorded.",
      "evidence_refs": [
        "https://gitlab.example/group/project/-/issues/123"
      ],
      "decision": {
        "result": "approve",
        "rationale": "Design review recorded.",
        "decided_by": "design-dri",
        "decided_at": "2026-10-12T12:00:00Z",
        "approval_or_record_ref": null
      }
    },
    "solution_validation": {
      "status": "completed",
      "entered_at": "2026-10-01T09:00:00Z",
      "exited_at": "2026-10-02T09:00:00Z",
      "owner": "pm-dri",
      "outcome_or_skip_rationale": "Problem and solution validation completed with the recorded user evidence.",
      "evidence_refs": [
        "https://gitlab.example/group/project/-/issues/123"
      ],
      "decision": {
        "result": "validate_solution",
        "rationale": "Problem and solution validation completed with the recorded user evidence.",
        "decided_by": "pm-dri",
        "decided_at": "2026-10-12T12:00:00Z",
        "approval_or_record_ref": null
      }
    },
    "success_hypotheses_and_metrics": [
      "hypothesis: metric changes after target version is deployed"
    ],
    "validation_evidence_refs": [
      "https://gitlab.example/group/project/-/issues/124"
    ]
  },
  "build_track": {
    "applicability": "applicable",
    "applicability_rationale": "Build applicability is a recorded decision for this synthetic scenario.",
    "plan": {
      "status": "completed",
      "entered_at": "2026-10-01T09:00:00Z",
      "exited_at": "2026-10-02T09:00:00Z",
      "owner": "pm-dri",
      "outcome_or_skip_rationale": "Scope, work type and prioritization decision recorded.",
      "evidence_refs": [
        "https://gitlab.example/group/project/-/issues/123"
      ],
      "decision": {
        "result": "continue",
        "rationale": "Scope, work type and prioritization decision recorded.",
        "decided_by": "pm-dri",
        "decided_at": "2026-10-12T12:00:00Z",
        "approval_or_record_ref": null
      }
    },
    "development": {
      "status": "rework",
      "entered_at": "2026-10-01T09:00:00Z",
      "exited_at": null,
      "owner": "eng-dri",
      "outcome_or_skip_rationale": "External implementation report references a source revision.",
      "evidence_refs": [
        "https://gitlab.example/group/project/-/issues/123"
      ],
      "decision": {
        "result": "continue",
        "rationale": "External implementation report references a source revision.",
        "decided_by": "eng-dri",
        "decided_at": "2026-10-12T12:00:00Z",
        "approval_or_record_ref": null
      }
    },
    "testing": {
      "status": "completed",
      "entered_at": "2026-10-01T09:00:00Z",
      "exited_at": "2026-10-02T09:00:00Z",
      "owner": "test-dri",
      "outcome_or_skip_rationale": "External checks and environment references are authored claims.",
      "evidence_refs": [
        "https://gitlab.example/group/project/-/issues/123"
      ],
      "decision": {
        "result": "continue",
        "rationale": "External checks and environment references are authored claims.",
        "decided_by": "test-dri",
        "decided_at": "2026-10-12T12:00:00Z",
        "approval_or_record_ref": null
      }
    },
    "review": {
      "status": "completed",
      "entered_at": "2026-10-01T09:00:00Z",
      "exited_at": "2026-10-02T09:00:00Z",
      "owner": "maintainer-dri",
      "outcome_or_skip_rationale": "External MR review status is reported.",
      "evidence_refs": [
        "https://gitlab.example/group/project/-/issues/123"
      ],
      "decision": {
        "result": "continue",
        "rationale": "External MR review status is reported.",
        "decided_by": "maintainer-dri",
        "decided_at": "2026-10-12T12:00:00Z",
        "approval_or_record_ref": null
      }
    },
    "verification": {
      "status": "completed",
      "entered_at": "2026-10-01T09:00:00Z",
      "exited_at": "2026-10-02T09:00:00Z",
      "owner": "release-dri",
      "outcome_or_skip_rationale": "Deployment verification must bind exact target version and environment.",
      "evidence_refs": [
        "https://gitlab.example/group/project/-/issues/123"
      ],
      "decision": {
        "result": "continue",
        "rationale": "Deployment verification must bind exact target version and environment.",
        "decided_by": "release-dri",
        "decided_at": "2026-10-12T12:00:00Z",
        "approval_or_record_ref": null
      }
    },
    "planning_refs": [
      "https://gitlab.example/group/project/-/issues/124"
    ],
    "test_and_review_refs": [
      "https://gitlab.example/group/project/-/issues/124"
    ]
  },
  "track_links": [
    {
      "relation": "feeds",
      "validation_work_ref": "https://gitlab.example/group/project/-/issues/124#validation",
      "build_work_ref": "https://gitlab.example/group/project/-/issues/124#build",
      "recorded_at": "2026-10-02T09:00:00Z",
      "recorded_by": "pm-dri",
      "rationale_or_decision_ref": "Synthetic coordination decision."
    }
  ],
  "blockers": [
    {
      "state": "resolved",
      "description": "Synthetic wait for external dependency/reviewer input.",
      "owner": "eng-dri",
      "opened_at": "2026-10-03T09:00:00Z",
      "expected_resolution_at": "2026-10-04T09:00:00Z",
      "actions_taken_refs": [
        "https://gitlab.example/group/project/-/issues/124#blocked"
      ],
      "resolution_or_escalation": "External reply received; team resumed at review with a new source revision.",
      "closed_at": "2026-10-04T10:00:00Z"
    }
  ],
  "rework": [
    {
      "trigger": "Synthetic external reviewer requested a correction after the first review.",
      "from_phase": "review",
      "new_revision_or_follow_up_ref": "https://gitlab.example/group/project/-/merge_requests/124#after-revision-2",
      "owner": "eng-dri",
      "status": "completed",
      "exit_criteria": "Revised code passes the required external checks and review is resolved.",
      "evidence_refs": [
        "https://gitlab.example/group/project/-/merge_requests/124#before-revision-1",
        "https://gitlab.example/group/project/-/merge_requests/124#after-revision-2"
      ]
    }
  ],
  "merge_requests": [
    {
      "url": "https://gitlab.example/group/project/-/merge_requests/124",
      "state": "merged",
      "source_revision": "synthetic-sha-a1b2",
      "merged_commit": "synthetic-sha-a1b2",
      "merged_at": "2026-10-09T09:00:00Z",
      "review_and_pipeline_refs": [
        "https://gitlab.example/group/project/-/issues/124"
      ],
      "merge_is_deployment_evidence": false
    }
  ],
  "deployment": {
    "target_model": "gitlab_com",
    "target_rationale": "Synthetic target selection; actual projects must choose and confirm their target.",
    "gitlab_com_path": {
      "applicability": "applicable",
      "rationale": "This scenario selects GitLab.com.",
      "release_or_package_binding": "synthetic release 1.2.3 / commit a",